CODIGO,DISTRITO,DEPARTAMENTO,MUNICIPIO,ESTABLECIMIENTO,DIRECCION,TELEFONO,SUPERVISOR,DIRECTOR,NIVEL,SECTOR,AREA,STATUS,MODALIDAD,JORNADA,PLAN,DEPARTAMENTAL
00-03-7621-46,,CIUDAD CAPITAL,ZONA 3,COLEGIO MIXTO SUPERIOR UNIVERSAL,AV. BOLIVAR 38-70,24715576,,,DIVERSIFICADO,PRIVADO,URBANA,CERRADA TEMPORALMENTE,MONOLINGUE,DOBLE,FIN DE SEMANA,GUATEMALA NORTE
00-03-8227-46,01-302,CIUDAD CAPITAL,ZONA 3,LICEO MARIANO GALVEZ,17 CALLE 4-03,22306679,HECTOR EDELMIRO FLORES BRINGUEZ,,DIVERSIFICADO,PRIVADO,URBANA,CERRADA TEMPORALMENTE,MONOLINGUE,VESPERTINA,DIARIO(REGULAR),GUATEMALA NORTE
00-03-8280-46,01-402,CIUDAD CAPITAL,ZONA 3,COLEGIO EVANGELICO MIXTO FRANCISCO G. PENZOTTI (POR MADUREZ),4A. AVE. 31-49,24402064,CARLOS HUMBERTO GONZALEZ DE LEON,,DIVERSIFICADO,PRIVADO,URBANA,CERRADA TEMPORALMENTE,MONOLINGUE,INTERMEDIA,SABATINO,GUATEMALA NORTE
00-03-8342-46,,CIUDAD CAPITAL,ZONA 3,ASOCAICION DE ALFABETIZACION Y SUPERACION INTEGRAL CRISTIANA (POR MADUREZ),6A. AVENIDA 27-96,24406218,,,DIVERSIFICADO,PRIVADO,URBANA,CERRADA TEMPORALMENTE,MONOLINGUE,MATUTINA,FIN DE SEMANA,GUATEMALA NORTE
00-03-8574-46,01-302,CIUDAD CAPITAL,ZONA 3,COLEGIO TECNICO MODERNO,AV. BOLIVAR 30-00,24712407,HECTOR EDELMIRO FLORES BRINGUEZ,---,DIVERSIFICADO,PRIVADO,URBANA,CERRADA TEMPORALMENTE,MONOLINGUE,VESPERTINA,DIARIO(REGULAR),GUATEMALA NORTE
00-03-8576-46,01-628,CIUDAD CAPITAL,ZONA 3,COLEGIO TECNICO MODERNO,AV. BOLIVAR 30-00,24712407-24720315,CARLOS HUMBERTO GONZALEZ DE LEON,,DIVERSIFICADO,PRIVADO,URBANA,CERRADA TEMPORALMENTE,MONOLINGUE,NOCTURNA,DIARIO(REGULAR),GUATEMALA NORTE
00-03-9227-46,01-302,CIUDAD CAPITAL,ZONA 3,CENTRO EDUCATIVO TECNOLOGICO EMILIANO,25 CALLE 1-49,24710821,HECTOR EDELMIRO FLORES BRINGUEZ,ROSA MARIA RECINOS ALVAREZ,DIVERSIFICADO,PRIVADO,URBANA,CERRADA TEMPORALMENTE,MONOLINGUE,MATUTINA,DIARIO(REGULAR),GUATEMALA NORTE
00-03-9228-46,01-403,CIUDAD CAPITAL,ZONA 3,CENTRO EDUCATIVO TECNOLOGICO EMILIANO,25 CALLE 1-49,49643184,CARLOS HUMBERTO GONZALEZ DE LEON,,DIVERSIFICADO,PRIVADO,URBANA,ABIERTA,MONOLINGUE,DOBLE,FIN DE SEMANA,GUATEMALA NORTE
00-03-9268-46,01-403,CIUDAD CAPITAL,ZONA 3,CENTRO EDUCATIVO TECNOLOGICO EMILIANO,25 CALLE 1-49,49643184,CARLOS HUMBERTO GONZALEZ DE LEON,,DIVERSIFICADO,PRIVADO,URBANA,ABIERTA,MONOLINGUE,DOBLE,FIN DE SEMANA,GUATEMALA NORTE
00-03-9800-46,99-001,CIUDAD CAPITAL,ZONA 3,ESCUELA 'JUANA DE ARCO' MIXTA,14 CALLE C 4-40,22321385-22323734,SILVIA EUGENIA VALDEZ MONTERROSO DE CARBALLO,-----,DIVERSIFICADO,PRIVADO,URBANA,TEMPORAL TITULOS,MONOLINGUE,MATUTINA,DIARIO(REGULAR),GUATEMALA NORTE
00-04-0005-46,01-312,CIUDAD CAPITAL,ZONA 4,INSTITUTO GUATEMALTECO AMERICANO-IGA-,RUTA 14-05,24225555,AMADO SALOMON FLORES PEREZ,CLAUDIA ELIZABETH SANCHEZ SANTOS DE LEIVA,DIVERSIFICADO,PRIVADO,URBANA,ABIERTA,MONOLINGUE,MATUTINA,DIARIO(REGULAR),GUATEMALA NORTE
00-04-0376-46,01-312,CIUDAD CAPITAL,ZONA 4,INSTITUTO GUATEMALTECO AMERICANO -IGA-,RUTA I 4-05,24225555,AMADO SALOMON FLORES PEREZ,,DIVERSIFICADO,PRIVADO,URBANA,ABIERTA,MONOLINGUE,MATUTINA,DIARIO(REGULAR),GUATEMALA NORTE
00-04-9689-46,01-312,CIUDAD CAPITAL,ZONA 4,INSTITUTO GUATEMALTECO AMERICANO IGA,"RUTA 1, 4-05",24225555,AMADO SALOMON FLORES PEREZ,,DIVERSIFICADO,PRIVADO,URBANA,CERRADA TEMPORALMENTE,MONOLINGUE,DOBLE,DIARIO(REGULAR),GUATEMALA NORTE
00-04-9791-46,99-001,CIUDAD CAPITAL,ZONA 4,ESCUELA DE CAPACITACION EN ADMINISTRACION MUNICIPAL ECAM,DIAGONAL,,SILVIA EUGENIA VALDEZ MONTERROSO DE CARBALLO,,DIVERSIFICADO,MUNICIPAL,URBANA,TEMPORAL TITULOS,MONOLINGUE,NOCTURNA,DIARIO(REGULAR),GUATEMALA NORTE
00-05-0001-46,01-101,CIUDAD CAPITAL,ZONA 5,LICEO MIXTO DE EDUCACION INTEGRAL,ZONA 5,,MARIA ESTELA MARROQUIN CHUR DE ORTEGA,---,DIVERSIFICADO,PRIVADO,URBANA,TEMPORAL TITULOS,MONOLINGUE,NOCTURNA,DIARIO(REGULAR),GUATEMALA ORIENTE
00-05-0007-46,01-313,CIUDAD CAPITAL,ZONA 5,ESCUELA SUPERIOR DE COMERCIO Y ACADEMIA ROYAL,27 CALLE 23-14,23316077,ERICK GUILLERMO SANCHEZ MARTINEZ,BLANCA ULIANOVA ALVARADO IBAÑEZ,DIVERSIFICADO,PRIVADO,URBANA,ABIERTA,MONOLINGUE,MATUTINA,DIARIO(REGULAR),GUATEMALA ORIENTE
00-05-0016-46,01-313,CIUDAD CAPITAL,ZONA 5,COLEGIO MARTA NOVELLA,27 AV. 27-45,23393125,ERICK GUILLERMO SANCHEZ MARTINEZ,ANA VIRGINIA RODAS VASQUEZ DE HERNANDEZ,DIVERSIFICADO,PRIVADO,URBANA,ABIERTA,MONOLINGUE,MATUTINA,DIARIO(REGULAR),GUATEMALA ORIENTE
00-05-0025-46,01-314,CIUDAD CAPITAL,ZONA 5,COLEGIO MADRID - BARCELONA,30 CALLE 22-38,35131111,PLINIO IVAN HERNANDEZ,JOSÉ RAFAEL VILLELA BOLLATH,DIVERSIFICADO,PRIVADO,URBANA,ABIERTA,MONOLINGUE,MATUTINA,DIARIO(REGULAR),GUATEMALA ORIENTE
00-05-0029-46,01-313,CIUDAD CAPITAL,ZONA 5,COLEGIO LOS NIÑOS DE SANTA MARIA,36 AVENIDA 12-37 JARDINES DE LA ASUNCIÓN,23349314,ERICK GUILLERMO SANCHEZ MARTINEZ,LAURA VERÓNICA MONZÓN CÁRCAMO,DIVERSIFICADO,PRIVADO,URBANA,ABIERTA,MONOLINGUE,MATUTINA,DIARIO(REGULAR),GUATEMALA ORIENTE
00-05-0031-46,01-504,CIUDAD CAPITAL,ZONA 5,INSTITUTO NACIONAL DE FORMACIÓN TÉCNICA,"28 AVENIDA ""A"" 33-50",55599573,DAVID SOTOJ SANCHEZ,ANA DE CORONADO,DIVERSIFICADO,OFICIAL,URBANA,ABIERTA,MONOLINGUE,DOBLE,DIARIO(REGULAR),GUATEMALA ORIENTE
00-05-0033-46,01-314,CIUDAD CAPITAL,ZONA 5,COLEGIO SAN AGUSTIN,21 CALLE 32-38 COLONIA LA PALMITA GUATEMALA,23356656,PLINIO IVAN HERNANDEZ,ESTEFANY VICTORIA COROY ALBEÑO,DIVERSIFICADO,PRIVADO,URBANA,ABIERTA,MONOLINGUE,MATUTINA,DIARIO(REGULAR),GUATEMALA ORIENTE
00-05-0454-46,01-504,CIUDAD CAPITAL,ZONA 5,INSTITUTO NACIONAL DE FORMACION TECNICA,28 AVE. A 33-50,23355168,DAVID SOTOJ SANCHEZ,,DIVERSIFICADO,OFICIAL,URBANA,ABIERTA,MONOLINGUE,VESPERTINA,DIARIO(REGULAR),GUATEMALA ORIENTE
00-05-0455-46,01-504,CIUDAD CAPITAL,ZONA 5,INSTITUTO DIVERSIFICADO CENTRAL DE MERCADOTECNIA Y PUBLICIDAD,42 AVENIDA 20-00,23350777,DAVID SOTOJ SANCHEZ,,DIVERSIFICADO,OFICIAL,URBANA,ABIERTA,MONOLINGUE,VESPERTINA,DIARIO(REGULAR),GUATEMALA ORIENTE
00-05-0457-46,01-314,CIUDAD CAPITAL,ZONA 5,ESCUELA PROFESIONAL SAN VICENTE DE PAUL,17 AVE 31-00,23329874,PLINIO IVAN HERNANDEZ,ELVIRA PÉREZ CONTRERAS DE DUBOIS,DIVERSIFICADO,PRIVADO,URBANA,ABIERTA,MONOLINGUE,MATUTINA,DIARIO(REGULAR),GUATEMALA ORIENTE
00-05-0458-46,01-405,CIUDAD CAPITAL,ZONA 5,CENTRO EDUCACIONAL MINERVA CEDMA,13 AVENIDA 25-74,23325242,BLANCA SARAI GUTIERREZ PINEDA,MARIA DEL SOCORRO TANCHEZ ROJAS DE DE LEON,DIVERSIFICADO,PRIVADO,URBANA,CERRADA TEMPORALMENTE,MONOLINGUE,NOCTURNA,DIARIO(REGULAR),GUATEMALA ORIENTE
00-05-2214-46,01-314,CIUDAD CAPITAL,ZONA 5,INSTITUTO PRIVADO DE EDUCACION DIVERSIFICADA LICEO GUATEMALA,10A AVE. 33-03,22095400,PLINIO IVAN HERNANDEZ,ERICKA DEL ROSARIO DARDÓN PAREDES,DIVERSIFICADO,PRIVADO,URBANA,ABIERTA,MONOLINGUE,MATUTINA,DIARIO(REGULAR),GUATEMALA ORIENTE
00-05-2481-46,01-313,CIUDAD CAPITAL,ZONA 5,INSTITUTO GUATEMALTECO ESPAÑOL,DIAGONAL 14 23-55 COL VIVIBIEN,23321393,ERICK GUILLERMO SANCHEZ MARTINEZ,MARÍA ANTONIETA ROSALES MURALLES DE RALÓN,DIVERSIFICADO,PRIVADO,URBANA,ABIERTA,MONOLINGUE,MATUTINA,DIARIO(REGULAR),GUATEMALA ORIENTE
00-05-2490-46,01-405,CIUDAD CAPITAL,ZONA 5,LICEO GUATEMALA JORNADA NOCTURNA E INTERMEDIA,10A AV 33-03,23341680,BLANCA SARAI GUTIERREZ PINEDA,RICARDO ORTIZ ROMERO,DIVERSIFICADO,PRIVADO,URBANA,CERRADA TEMPORALMENTE,MONOLINGUE,INTERMEDIA,DIARIO(REGULAR),GUATEMALA ORIENTE
00-05-2912-46,,CIUDAD CAPITAL,ZONA 5,LICEO MIXTO DE EDUCACION INTEGRAL,11 AV. 'A' 27-65,,,,DIVERSIFICADO,PRIVADO,URBANA,CERRADA TEMPORALMENTE,MONOLINGUE,MATUTINA,DIARIO(REGULAR),GUATEMALA ORIENTE
00-05-3067-46,01-313,CIUDAD CAPITAL,ZONA 5,CENTRO ESTUDIANTIL DE ENSEÑANZA MEDIA,17 AVE 27-52,23327777,ERICK GUILLERMO SANCHEZ MARTINEZ,,DIVERSIFICADO,PRIVADO,URBANA,CERRADA TEMPORALMENTE,MONOLINGUE,MATUTINA,DIARIO(REGULAR),GUATEMALA ORIENTE
00-05-7952-46,,CIUDAD CAPITAL,ZONA 5,LICEO MIXTO EN COMPUTACION 'GUATEMALTECO SAN CARLOS',22 CALLE 36-49 COLONIA ARRIVILLAGA,23350996,,,DIVERSIFICADO,PRIVADO,URBANA,CERRADA TEMPORALMENTE,MONOLINGUE,NOCTURNA,DIARIO(REGULAR),GUATEMALA ORIENTE
00-05-7953-46,01-405,CIUDAD CAPITAL,ZONA 5,LICEO MIXTO EN COMPUTACION GUATEMALTECO SAN CARLOS,22 CALLE 36-49 COLONIA ARRIVILLAGA 22 CALLE 36-49 ZONA 5 COLONIA ARRIVILLAGA,23354018,BLANCA SARAI GUTIERREZ PINEDA,LICDA. DORIS ZUNUN CARRERA,DIVERSIFICADO,PRIVADO,URBANA,CERRADA TEMPORALMENTE,MONOLINGUE,DOBLE,FIN DE SEMANA,GUATEMALA ORIENTE
00-05-7955-46,01-314,CIUDAD CAPITAL,ZONA 5,LICEO MIXTO EN COMPUTACION GUATEMALTECO SAN CARLOS,22 CALLE 36-49 COLONIA ARRIVILLAGA,23354018,PLINIO IVAN HERNANDEZ,,DIVERSIFICADO,PRIVADO,URBANA,CERRADA TEMPORALMENTE,MONOLINGUE,MATUTINA,DIARIO(REGULAR),GUATEMALA ORIENTE
00-05-8102-46,01-313,CIUDAD CAPITAL,ZONA 5,INSTITUTO ESCRITURA VELOZ (SPEEDWRITING),27 CALLE 23-14,23316077,ERICK GUILLERMO SANCHEZ MARTINEZ,,DIVERSIFICADO,PRIVADO,URBANA,CERRADA TEMPORALMENTE,MONOLINGUE,MATUTINA,DIARIO(REGULAR),GUATEMALA ORIENTE
00-05-8161-46,,CIUDAD CAPITAL,ZONA 5,CENTRO EDUCACIONAL MINERVA 'CEDMA',13 AVE. 25-74,23325242,,,DIVERSIFICADO,PRIVADO,URBANA,CERRADA TEMPORALMENTE,MONOLINGUE,MATUTINA,FIN DE SEMANA,GUATEMALA ORIENTE
00-05-8233-46,01-313,CIUDAD CAPITAL,ZONA 5,CENTRO EDUCATIVO ACRÓPOLIS,12 CALLE B 40-81 JARDINES DE LA ASUNCION,23360138,ERICK GUILLERMO SANCHEZ MARTINEZ,,DIVERSIFICADO,PRIVADO,URBANA,ABIERTA,MONOLINGUE,MATUTINA,DIARIO(REGULAR),GUATEMALA ORIENTE
00-05-8283-46,01-313,CIUDAD CAPITAL,ZONA 5,COLEGIO EVANGELICO MIXTO ADONAI,29 CALLE 22-14,23354466,ERICK GUILLERMO SANCHEZ MARTINEZ,ANA LUISA GUERRA CASTAÑEDA DE DÁVILA,DIVERSIFICADO,PRIVADO,URBANA,ABIERTA,MONOLINGUE,MATUTINA,DIARIO(REGULAR),GUATEMALA ORIENTE
00-05-8475-46,01-405,CIUDAD CAPITAL,ZONA 5,CENTRO ESTUDIANTIL DE ENSEÑANZA MEDIA (POR MADUREZ),17 AV. 27-52,23327777,BLANCA SARAI GUTIERREZ PINEDA,SIN DATO,DIVERSIFICADO,PRIVADO,URBANA,CERRADA TEMPORALMENTE,MONOLINGUE,DOBLE,FIN DE SEMANA,GUATEMALA ORIENTE
00-05-8531-46,01-,CIUDAD CAPITAL,ZONA 5,LICEO GUATEMALTECO EN ESTUDIOS DE COMPUTACION,19 AVENIDA 27-11 COLONIA SAN PEDRITO,23623262,MARIA FELICITA ROQUE CARRERA,,DIVERSIFICADO,PRIVADO,URBANA,CERRADA TEMPORALMENTE,MONOLINGUE,MATUTINA,DIARIO(REGULAR),GUATEMALA ORIENTE
00-05-8557-46,01-405,CIUDAD CAPITAL,ZONA 5,LICEO GUATEMALTECO DE ESTUDIOS EN COMPUTACION,19AV. 27-11 ZONA 5 COLONIA SAN PEDRITO,23623262,BLANCA SARAI GUTIERREZ PINEDA,,DIVERSIFICADO,PRIVADO,URBANA,CERRADA TEMPORALMENTE,MONOLINGUE,DOBLE,FIN DE SEMANA,GUATEMALA ORIENTE
00-05-8861-46,01-405,CIUDAD CAPITAL,ZONA 5,LICEO MIXTO 'NUESTRA SEÑORA DE MEDJUGORJE',21 CALLE 'A' 38-65 COLONIA ARRIVILLAGA,23354385,BLANCA SARAI GUTIERREZ PINEDA,,DIVERSIFICADO,PRIVADO,URBANA,CERRADA TEMPORALMENTE,MONOLINGUE,MATUTINA,FIN DE SEMANA,GUATEMALA ORIENTE
00-05-8862-46,01-405,CIUDAD CAPITAL,ZONA 5,LICEO MIXTO 'NUESTRA SEÑORA DE MEDJUGORJE',21 CALLE 'A' 38-65 COLONIA ARRIVILLAGA,23354385,BLANCA SARAI GUTIERREZ PINEDA,,DIVERSIFICADO,PRIVADO,URBANA,CERRADA TEMPORALMENTE,MONOLINGUE,VESPERTINA,FIN DE SEMANA,GUATEMALA ORIENTE
00-05-8941-46,01-313,CIUDAD CAPITAL,ZONA 5,ESCUELA MILITAR DE MÚSICA MAESTRO RAFAEL ALVAREZ OVALLE,23 AVENIDA FINAL 32-36,44974290,ERICK GUILLERMO SANCHEZ MARTINEZ,HUGO FERNANDO RODRÍGUEZ CIFUENTES,DIVERSIFICADO,OFICIAL,URBANA,ABIERTA,MONOLINGUE,DOBLE,DIARIO(REGULAR),GUATEMALA ORIENTE
00-05-9794-46,99-001,CIUDAD CAPITAL,ZONA 5,INSTITUTO TECNICO FEMENINO,28 AVENIDA A 33-50,,SILVIA EUGENIA VALDEZ MONTERROSO DE CARBALLO,DORIS LEONOR ZUNUN CARRERA,DIVERSIFICADO,OFICIAL,URBANA,TEMPORAL TITULOS,MONOLINGUE,VESPERTINA,DIARIO(REGULAR),GUATEMALA ORIENTE
00-05-9801-46,99-001,CIUDAD CAPITAL,ZONA 5,INSTITUTO MIXTO NOCTURNO 'JOSE BATRES MONTUFAR',28 CALLE,,SILVIA EUGENIA VALDEZ MONTERROSO DE CARBALLO,,DIVERSIFICADO,PRIVADO,URBANA,TEMPORAL TITULOS,MONOLINGUE,NOCTURNA,DIARIO(REGULAR),GUATEMALA ORIENTE
00-05-9827-46,99-001,CIUDAD CAPITAL,ZONA 5,LICEO PARTICULAR MIXTO EPISCOPAL,13 CALL EY 7A. AVENIDA,,SILVIA EUGENIA VALDEZ MONTERROSO DE CARBALLO,,DIVERSIFICADO,PRIVADO,URBANA,TEMPORAL TITULOS,MONOLINGUE,VESPERTINA,DIARIO(REGULAR),GUATEMALA ORIENTE
00-06-0007-46,01-106,CIUDAD CAPITAL,ZONA 6,LICEO DE CIENCIAS TECNICAS,1A. CALLE 13-59,22881033,CESAR ARNOLDO MARTINEZ GARCIA,CARLOS HUMBERTO BARRIOS LOPEZ,DIVERSIFICADO,PRIVADO,URBANA,ABIERTA,MONOLINGUE,DOBLE,FIN DE SEMANA,GUATEMALA NORTE
00-06-0008-46,01-106,CIUDAD CAPITAL,ZONA 6,LICEO DE CIENCIAS TECNICAS,1A. CALLE 13-59,22881033,CESAR ARNOLDO MARTINEZ GARCIA,CARLOS HUMBERTO BARRIOS LOPEZ,DIVERSIFICADO,PRIVADO,URBANA,ABIERTA,MONOLINGUE,DOBLE,FIN DE SEMANA,GUATEMALA NORTE
00-06-0012-46,01-403,CIUDAD CAPITAL,ZONA 6,COLEGIO PANAMERICANO NO. 7,"CALZADA JOSÉ MILLA Y VIDAURRE 17-30, PLAZA JOSÉ MILLA LOCAL 2",22549965,CARLOS HUMBERTO GONZALEZ DE LEON,EMMY LISSETH ORTIZ GARCIA,DIVERSIFICADO,PRIVADO,URBANA,CERRADA TEMPORALMENTE,MONOLINGUE,DOBLE,FIN DE SEMANA,GUATEMALA NORTE
00-06-0013-46,01-101,CIUDAD CAPITAL,ZONA 6,COLEGIO PANAMERICANO NO. 7,"CALZADA JOSÉ MILLA Y VIDAURRE, 17-30, PLAZA JOSÉ MILLA, LOCAL 2",22549967,MARIA ESTELA MARROQUIN CHUR DE ORTEGA,EMMY LISSETH ORTIZ GARCIA,DIVERSIFICADO,PRIVADO,URBANA,CERRADA TEMPORALMENTE,MONOLINGUE,MATUTINA,DIARIO(REGULAR),GUATEMALA NORTE
00-06-0014-46,01-102,CIUDAD CAPITAL,ZONA 6,COLEGIO PANAMERICANO NO. 7,"CALZADA JOSÉ MILLA Y VIDAURRE 17-30, PLAZA JOSÉ MILLA, LOCAL 2",22549965,ZIZI ARELY LOPEZ CHINCHILLA,CARLOS ALFREDO CARRILLO GARCÍA SALAS,DIVERSIFICADO,PRIVADO,URBANA,CERRADA TEMPORALMENTE,MONOLINGUE,VESPERTINA,DIARIO(REGULAR),GUATEMALA NORTE
00-06-0021-46,01-403,CIUDAD CAPITAL,ZONA 6,COLEGIO PANAMERICANO NO. 7,"CALZADA JOSE MILLA Y VIDAURRE, 17-30, PLAZA JOSE MILLA, LOCAL 2",55500469,CARLOS HUMBERTO GONZALEZ DE LEON,EMMY LISSETH ORTIZ GARCIA,DIVERSIFICADO,PRIVADO,URBANA,CERRADA TEMPORALMENTE,MONOLINGUE,DOBLE,FIN DE SEMANA,GUATEMALA NORTE
00-06-0022-46,01-102,CIUDAD CAPITAL,ZONA 6,COLEGIO MARIANNE FROSTIG,15 AVENIDA 8-35,40344543,ZIZI ARELY LOPEZ CHINCHILLA,ATALA MARIA ARRIOLA MANSILLA DE CHAVEZ,DIVERSIFICADO,PRIVADO,URBANA,ABIERTA,MONOLINGUE,MATUTINA,DIARIO(REGULAR),GUATEMALA NORTE
00-06-0023-46,01-102,CIUDAD CAPITAL,ZONA 6,COLEGIO MARIANNE FROSTIG,15 AVENIDA 8-35,22881700,ZIZI ARELY LOPEZ CHINCHILLA,JULIO ALEJANDRO ORELLANA,DIVERSIFICADO,PRIVADO,URBANA,CERRADA TEMPORALMENTE,MONOLINGUE,VESPERTINA,DIARIO(REGULAR),GUATEMALA NORTE
00-06-0024-46,01-407,CIUDAD CAPITAL,ZONA 6,COLEGIO MARIANNE FROSTIG,15 AVENIDA 8-35,22881700,CARLOS HUMBERTO GONZALEZ DE LEON,JULIO ALEJANDRO ORELLANA,DIVERSIFICADO,PRIVADO,URBANA,CERRADA TEMPORALMENTE,MONOLINGUE,DOBLE,FIN DE SEMANA,GUATEMALA NORTE
00-06-0028-46,01-101,CIUDAD CAPITAL,ZONA 6,LICEO PROFESOR DAVID LETRAN,6TA. CALLE 20-64,44731032,MARIA ESTELA MARROQUIN CHUR DE ORTEGA,ALMA ISABEL OLIVA HERRERA,DIVERSIFICADO,PRIVADO,URBANA,ABIERTA,MONOLINGUE,MATUTINA,DIARIO(REGULAR),GUATEMALA NORTE
00-06-0032-46,01-403,CIUDAD CAPITAL,ZONA 6,"INSTITUTO NACIONAL DE EDUCACIÓN DIVERSIFICADA ""CARLOS BENJAMIN PAIZ AYALA""","FINAL, CALZADA JOSE MILLA Y VIDAURRE Y 26 AVENIDA",22102943,CARLOS HUMBERTO GONZALEZ DE LEON,JOVITA ANTONIETA MIRANDA BARRIOS,DIVERSIFICADO,OFICIAL,URBANA,ABIERTA,MONOLINGUE,NOCTURNA,DIARIO(REGULAR),GUATEMALA NORTE
00-06-0033-46,01-403,CIUDAD CAPITAL,ZONA 6,"INSTITUTO NACIONAL DE EDUCACIÓN DIVERSIFICADA ""CARLOS BENJAMIN PAIZ AYALA ""","FINAL, CALZADA JOSE MILLA Y VIDAURRE Y 26 AVENIDA",22702943,CARLOS HUMBERTO GONZALEZ DE LEON,JOVITA ANTONIETA MIRANDA BARRIOS,DIVERSIFICADO,OFICIAL,URBANA,ABIERTA,MONOLINGUE,NOCTURNA,DIARIO(REGULAR),GUATEMALA NORTE
00-06-0038-46,01-101,CIUDAD CAPITAL,ZONA 6,"""LICEO DE COMPUTACIÓN C.S.S, ZONA 6""",CALLE MARTI 14-49 ZONA 6,22882093,MARIA ESTELA MARROQUIN CHUR DE ORTEGA,LEONEL RAMIRO ALVAREZ CARRERA,DIVERSIFICADO,PRIVADO,URBANA,ABIERTA,MONOLINGUE,VESPERTINA,DIARIO(REGULAR),GUATEMALA NORTE
00-06-0042-46,01-102,CIUDAD CAPITAL,ZONA 6,LICEO TECNOLÓGICO GUATEMALTECO,"15 AVENIDA ""B"" 10-23",22885205,ZIZI ARELY LOPEZ CHINCHILLA,VILMA ISABEL OROZCO LOPEZ DE RAMIREZ,DIVERSIFICADO,PRIVADO,URBANA,ABIERTA,MONOLINGUE,MATUTINA,DIARIO(REGULAR),GUATEMALA NORTE
00-06-0045-46,01-403,CIUDAD CAPITAL,ZONA 6,LICEO TECNÓLOGICO GUATEMALTECO,"15 AVENIDA ""B"" 10-23",22885205,CARLOS HUMBERTO GONZALEZ DE LEON,SILVIA LUCRECIA HERNANDEZ ROSALES DE REYES,DIVERSIFICADO,PRIVADO,URBANA,ABIERTA,MONOLINGUE,MATUTINA,FIN DE SEMANA,GUATEMALA NORTE
00-06-0046-46,01-403,CIUDAD CAPITAL,ZONA 6,LICEO TECNÓLOGICO GUATEMALTECO,"15 AVENIDA ""B"" 10-23",22885205,CARLOS HUMBERTO GONZALEZ DE LEON,SILVIA LUCRECIA HERNANDEZ ROSALES DE REYES,DIVERSIFICADO,PRIVADO,URBANA,ABIERTA,MONOLINGUE,MATUTINA,FIN DE SEMANA,GUATEMALA NORTE
00-06-0049-46,01-101,CIUDAD CAPITAL,ZONA 6,LICEO MIXTO BILINGÜE JOSÉ MARÍA ORELLANA,17 AVENIDA 21-97 PROYECTO 4-4,22542497,MARIA ESTELA MARROQUIN CHUR DE ORTEGA,LILY PATRICIA MENDIZABAL ARRIOLA DE RODRIGUEZ,DIVERSIFICADO,PRIVADO,URBANA,ABIERTA,MONOLINGUE,MATUTINA,DIARIO(REGULAR),GUATEMALA NORTE
00-06-0050-46,01-102,CIUDAD CAPITAL,ZONA 6,"COLEGIO PRIVADO ""TERESA DE AVILA""",15 AVENIDA 5-45,22880382,ZIZI ARELY LOPEZ CHINCHILLA,SILVIA LILIANA BARRILLAS MARROQUIN DE CANO,DIVERSIFICADO,PRIVADO,URBANA,ABIERTA,MONOLINGUE,MATUTINA,DIARIO(REGULAR),GUATEMALA NORTE
00-06-0051-46,01-102,CIUDAD CAPITAL,ZONA 6,"COLEGIO PRIVADO ""TERESA DE AVILA""",15 AVENIDA 5-45,22703364,ZIZI ARELY LOPEZ CHINCHILLA,SILVIA LILIANA BARILLAS MARROQUN DE CANO,DIVERSIFICADO,PRIVADO,URBANA,ABIERTA,MONOLINGUE,MATUTINA,DIARIO(REGULAR),GUATEMALA NORTE
00-06-0053-46,01-403,CIUDAD CAPITAL,ZONA 6,LICEO DE COMPUTACIÓN C.S.S.,CALLE MARTI 14-49,22882093,CARLOS HUMBERTO GONZALEZ DE LEON,LEONEL RAMIRO ALVAREZ CABRERA,DIVERSIFICADO,PRIVADO,URBANA,ABIERTA,MONOLINGUE,DOBLE,FIN DE SEMANA,GUATEMALA NORTE
00-06-0055-46,01-101,CIUDAD CAPITAL,ZONA 6,"COLEGIO CRISTIANO ""SEMILLAS DE AMOR""","5A. CALLE ""A"" 17-15",22544806,MARIA ESTELA MARROQUIN CHUR DE ORTEGA,EVGENY FRINE POLANCO VILLATORO,DIVERSIFICADO,PRIVADO,URBANA,ABIERTA,MONOLINGUE,VESPERTINA,DIARIO(REGULAR),GUATEMALA NORTE
00-06-0056-46,01-101,CIUDAD CAPITAL,ZONA 6,"ESCUELA EXPERIMENTAL CON ORIENTACIÓN OCUPACIONAL ""VILLA DE LOS NIÑOS""",16 AVENIDA FINAL 22-99 PROYECTO 4-4,22543139,MARIA ESTELA MARROQUIN CHUR DE ORTEGA,JULIO CARLOS HERNANDEZ DIEGUEZ,DIVERSIFICADO,PRIVADO,URBANA,ABIERTA,MONOLINGUE,DOBLE,DIARIO(REGULAR),GUATEMALA NORTE
00-06-0057-46,01-403,CIUDAD CAPITAL,ZONA 6,"INSTITUTO MIXTO PRIVADO ""JOSÉ ERNESTO MONZÓN",21 AVEIDA 15-42,22886512,CARLOS HUMBERTO GONZALEZ DE LEON,LILIAN ESPERANZA GONZLEZ DE LEON,DIVERSIFICADO,PRIVADO,URBANA,CERRADA TEMPORALMENTE,MONOLINGUE,MATUTINA,FIN DE SEMANA,GUATEMALA NORTE
00-06-0058-46,01-101,CIUDAD CAPITAL,ZONA 6,COLEGIO PANAMERICANO NO. 7,"CALZADA JOS MILLA Y VIDAURRE 17-30, PLAZA JOSE MILLA, LOCAL 2",22549967,MARIA ESTELA MARROQUIN CHUR DE ORTEGA,EMMY LISSETH ORTIZ GARCIA,DIVERSIFICADO,PRIVADO,URBANA,CERRADA TEMPORALMENTE,MONOLINGUE,MATUTINA,DIARIO(REGULAR),GUATEMALA NORTE
00-06-0059-46,01-102,CIUDAD CAPITAL,ZONA 6,COLEGIO MIXTO CIPRESALES,15 AVENIDA 15-49,22882123,ZIZI ARELY LOPEZ CHINCHILLA,EMMA ETELVINA ORELLLANA RAMIREZ DE CANO,DIVERSIFICADO,PRIVADO,URBANA,ABIERTA,MONOLINGUE,VESPERTINA,DIARIO(REGULAR),GUATEMALA NORTE
00-06-0062-46,01-403,CIUDAD CAPITAL,ZONA 6,"""COLEGIO POLITÉCNICO""",21 AVENIDA 15-42,22219364,CARLOS HUMBERTO GONZALEZ DE LEON,YUDY JANET ORELLANA GALINDO DE PEREZ,DIVERSIFICADO,PRIVADO,URBANA,CERRADA TEMPORALMENTE,MONOLINGUE,MATUTINA,FIN DE SEMANA,GUATEMALA NORTE
00-06-0064-46,01-403,CIUDAD CAPITAL,ZONA 6,COLEGIO CLÁSICO GUATEMALTECO,15 AVENIDA 07-61,52394686,CARLOS HUMBERTO GONZALEZ DE LEON,RONY ARTURO CHINCHILLA CRISTALES,DIVERSIFICADO,PRIVADO,URBANA,CERRADA TEMPORALMENTE,MONOLINGUE,DOBLE,FIN DE SEMANA,GUATEMALA NORTE
00-06-0065-46,01-403,CIUDAD CAPITAL,ZONA 6,COLEGIO CLÁSICO GUATEMALTECO,15 AVENIDA 07-61,52394686,CARLOS HUMBERTO GONZALEZ DE LEON,RONY ARTURO CHINCHILLA CRISTALES,DIVERSIFICADO,PRIVADO,URBANA,ABIERTA,MONOLINGUE,DOBLE,FIN DE SEMANA,GUATEMALA NORTE
00-06-0069-46,01-102,CIUDAD CAPITAL,ZONA 6,COLEGIO CLÁSICO GUATEMALTECO,15 AVENIDA 07-61,52394686,ZIZI ARELY LOPEZ CHINCHILLA,RONY ARTURO CHINCHILLA CRISTALES,DIVERSIFICADO,PRIVADO,URBANA,ABIERTA,MONOLINGUE,MATUTINA,DIARIO(REGULAR),GUATEMALA NORTE
00-06-0073-46,01-101,CIUDAD CAPITAL,ZONA 6,LICEO MIXTO BILINGÜE JOSE MARIA ORELLANA,"17 AVENIDA 21-97, PROYECTO 4-4",22542497,MARIA ESTELA MARROQUIN CHUR DE ORTEGA,HECTOR RONALDO CLAVERIA SANDOVAL,DIVERSIFICADO,PRIVADO,URBANA,CERRADA TEMPORALMENTE,MONOLINGUE,VESPERTINA,DIARIO(REGULAR),GUATEMALA NORTE
00-06-0074-46,01-102,CIUDAD CAPITAL,ZONA 6,LICEO DE COMPUTACIÓN C.S.S.,CALLE MARTI 14-49,22882093,ZIZI ARELY LOPEZ CHINCHILLA,LEONEL RAMIRO ALVAREZ CARRERA,DIVERSIFICADO,PRIVADO,URBANA,ABIERTA,MONOLINGUE,DOBLE,DIARIO(REGULAR),GUATEMALA NORTE
00-06-0077-46,01-403,CIUDAD CAPITAL,ZONA 6,"INSTITUTO NACIONAL DE EDUCACION DIVERSIFICADA ""DOCTORA SARA CABARRUS DE RUÍZ""",FINAL CALZADA JOSE MILLA Y VIDAURRE Y 27 AVENIDA,22702943,CARLOS HUMBERTO GONZALEZ DE LEON,JOVITA ANTONIETA MIRANDA BARRIOS DE ESTRADA,DIVERSIFICADO,OFICIAL,URBANA,ABIERTA,MONOLINGUE,NOCTURNA,DIARIO(REGULAR),GUATEMALA NORTE
00-06-0078-46,01-403,CIUDAD CAPITAL,ZONA 6,"INSTITUTO NACIONAL DE EDUCACIÓN DIVERSIFICADA ""DOCTORA SARA CABARRUS DE RUÍZ""",FINAL CALZADA JOSÉ MILLA Y VÍDAURRE Y 27 AVENIDA,22702943,CARLOS HUMBERTO GONZALEZ DE LEON,JOVITA ANTONIETA MIRANDA BARRIOS DE ESTRADA,DIVERSIFICADO,OFICIAL,URBANA,ABIERTA,MONOLINGUE,NOCTURNA,DIARIO(REGULAR),GUATEMALA NORTE
00-06-0079-46,01-101,CIUDAD CAPITAL,ZONA 6,"ESCUELA EXPERIMENTAL CON ORIENTACION OCUPACIONAL ""VILLA DE LOS NIÑOS""",16 AVENIDA FINAL 22-99 PROYECTO 4-4,22543170,MARIA ESTELA MARROQUIN CHUR DE ORTEGA,VICTOR EMILIO GÓMEZ MENDOZA,DIVERSIFICADO,PRIVADO,URBANA,ABIERTA,MONOLINGUE,MATUTINA,DIARIO(REGULAR),GUATEMALA NORTE
00-06-0526-46,01-102,CIUDAD CAPITAL,ZONA 6,"ESCUELA NACIONAL DE CIENCIAS COMERCIALES ""ROMULO GALLEGOS FREIRE""",15 CALLE Y 13 AVENIDA,22894358,ZIZI ARELY LOPEZ CHINCHILLA,CARMEN ORALIA RODRIGUEZ FRANCO,DIVERSIFICADO,OFICIAL,URBANA,ABIERTA,MONOLINGUE,VESPERTINA,DIARIO(REGULAR),GUATEMALA NORTE
00-06-0527-46,01-102,CIUDAD CAPITAL,ZONA 6,INSTITUTO PRIVADO MIXTO DE EDUCACION DIVERSIFICADA 'DR. RODOLFO ROBLES',1A CALLE 12-71,22885288,ZIZI ARELY LOPEZ CHINCHILLA,---,DIVERSIFICADO,PRIVADO,URBANA,ABIERTA,MONOLINGUE,MATUTINA,DIARIO(REGULAR),GUATEMALA NORTE
00-06-3071-46,01-102,CIUDAD CAPITAL,ZONA 6,"""LICEO DE COMPUTACIÓN C.S.S, ZONA 6""",CALLE MARTI 14-49,22882093,ZIZI ARELY LOPEZ CHINCHILLA,,DIVERSIFICADO,PRIVADO,URBANA,ABIERTA,MONOLINGUE,MATUTINA,DIARIO(REGULAR),GUATEMALA NORTE
00-06-3097-46,01-101,CIUDAD CAPITAL,ZONA 6,ACADEMIA DE LA POLICIA NACIONAL,"15 CALLE 16-00, COLONIA CIPRESALES ZONA 6",22563642,MARIA ESTELA MARROQUIN CHUR DE ORTEGA,,DIVERSIFICADO,OFICIAL,URBANA,CERRADA TEMPORALMENTE,MONOLINGUE,MATUTINA,DIARIO(REGULAR),GUATEMALA NORTE
00-06-4201-46,01-101,CIUDAD CAPITAL,ZONA 6,LICEO DE CIENCIAS TECNICAS,1A. CALLE 13-59,22881033,MARIA ESTELA MARROQUIN CHUR DE ORTEGA,CARLOS HUMBERTO BARRIOS LOPEZ,DIVERSIFICADO,PRIVADO,URBANA,ABIERTA,MONOLINGUE,VESPERTINA,DIARIO(REGULAR),GUATEMALA NORTE
00-06-4365-46,01-102,CIUDAD CAPITAL,ZONA 6,LICEO DE CIENCIAS TECNICAS,1A. CALLE 13-59,22881033,ZIZI ARELY LOPEZ CHINCHILLA,MIRIAM MENDEZ VASQUEZ DE CARIAS,DIVERSIFICADO,PRIVADO,URBANA,ABIERTA,MONOLINGUE,MATUTINA,DIARIO(REGULAR),GUATEMALA NORTE
00-06-4407-46,01-407,CIUDAD CAPITAL,ZONA 6,LICEO DE CIENCIAS TECNICAS,1A CALLE 13-59,22881033,CARLOS HUMBERTO GONZALEZ DE LEON,,DIVERSIFICADO,PRIVADO,URBANA,TEMPORAL TITULOS,MONOLINGUE,INTERMEDIA,DIARIO(REGULAR),GUATEMALA NORTE
00-06-4731-46,01-102,CIUDAD CAPITAL,ZONA 6,INSTITUTO MIXTO DR. RODOLFO ROBLES,1A. CALLE 12-71,22885288,ZIZI ARELY LOPEZ CHINCHILLA,,DIVERSIFICADO,PRIVADO,URBANA,ABIERTA,MONOLINGUE,VESPERTINA,DIARIO(REGULAR),GUATEMALA NORTE
00-06-7241-46,01-101,CIUDAD CAPITAL,ZONA 6,"CENTRO ESTUDIANTIL FENIX ""CEF""",1A. CALLE A 22-52 COLONIA LOS ANGELES,22545281,MARIA ESTELA MARROQUIN CHUR DE ORTEGA,ANGELICA BECILIA PACHECO MAZARIEGOS,DIVERSIFICADO,PRIVADO,URBANA,ABIERTA,MONOLINGUE,MATUTINA,DIARIO(REGULAR),GUATEMALA NORTE
00-06-7248-46,,CIUDAD CAPITAL,ZONA 6,COLEGIO DE FORMACION PROFESIONAL EN COMPUTACION (CFPC),28 CALLE 15-08 COLONIA EL MOLINO,22891784,,,DIVERSIFICADO,PRIVADO,URBANA,CERRADA TEMPORALMENTE,MONOLINGUE,VESPERTINA,DIARIO(REGULAR),GUATEMALA NORTE
00-06-7570-46,01-102,CIUDAD CAPITAL,ZONA 6,"COLEGIO PRIVADO ""TERESA DE AVILA""",15 AV. 5-45,22880382,ZIZI ARELY LOPEZ CHINCHILLA,,DIVERSIFICADO,PRIVADO,URBANA,ABIERTA,MONOLINGUE,VESPERTINA,DIARIO(REGULAR),GUATEMALA NORTE
00-06-7602-46,01-,CIUDAD CAPITAL,ZONA 6,COLEGIO MIXTO DE INFORMATICA Y DESARROLLO HUMANO PRINCIPAL MARIA (POR MADUREZ),17AV. A 25-14 PROYECTO 4-3,28920912,MARIA FELICITA ROQUE CARRERA,,DIVERSIFICADO,PRIVADO,URBANA,CERRADA TEMPORALMENTE,MONOLINGUE,MATUTINA,SABATINO,GUATEMALA NORTE
00-06-7767-46,,CIUDAD CAPITAL,ZONA 6,CENTRO DE COMPUTACION IMB-PC NO. 2,11 AVENIDA 5-16 MARTINICO,22540051,,,DIVERSIFICADO,PRIVADO,URBANA,CERRADA TEMPORALMENTE,MONOLINGUE,MATUTINA,DIARIO(REGULAR),GUATEMALA NORTE
00-06-7816-46,01-102,CIUDAD CAPITAL,ZONA 6,COLEGIO MIXTO CIPRESALES,15AV. C 15-15,22882123,ZIZI ARELY LOPEZ CHINCHILLA,,DIVERSIFICADO,PRIVADO,URBANA,ABIERTA,MONOLINGUE,MATUTINA,DIARIO(REGULAR),GUATEMALA NORTE
00-06-7858-46,01-101,CIUDAD CAPITAL,ZONA 6,LICEO EN COMPUTACION 2000,3A. CALLE 16-29,22067425,MARIA ESTELA MARROQUIN CHUR DE ORTEGA,---,DIVERSIFICADO,PRIVADO,URBANA,CERRADA TEMPORALMENTE,MONOLINGUE,MATUTINA,DIARIO(REGULAR),GUATEMALA NORTE
00-06-7859-46,01-101,CIUDAD CAPITAL,ZONA 6,LICEO EN COMPUTACION 2000,3A. CALLE 16-29,22545836,MARIA ESTELA MARROQUIN CHUR DE ORTEGA,,DIVERSIFICADO,PRIVADO,URBANA,CERRADA TEMPORALMENTE,MONOLINGUE,VESPERTINA,DIARIO(REGULAR),GUATEMALA NORTE
00-06-7958-46,01-402,CIUDAD CAPITAL,ZONA 6,COLEGIO DE FORMACION PROFESIONAL EN COMPUTACION (C.F.P.C),"28 CALLE 15-08, COLONIA EL MOLINO",22891784,CARLOS HUMBERTO GONZALEZ DE LEON,,DIVERSIFICADO,PRIVADO,URBANA,CERRADA TEMPORALMENTE,MONOLINGUE,NOCTURNA,DIARIO(REGULAR),GUATEMALA NORTE
00-06-8438-46,01-101,CIUDAD CAPITAL,ZONA 6,INSTITUTO DE EDUCACION BASICA POR MADUREZ Y BACHILLERATO EN CC.LL POR MADUREZ ADSC. POLICIA NACIONAL CIVIL,21AV 12-17,24299965,MARIA ESTELA MARROQUIN CHUR DE ORTEGA,MARIO RODOLFO LOPEZ RUIZ,DIVERSIFICADO,OFICIAL,URBANA,ABIERTA,MONOLINGUE,DOBLE,SABATINO,GUATEMALA NORTE
